{
  "schema_version": "1.0.0",
  "request_id": "toolreq_interpret123",
  "tool_name": "interpret_request",
  "status": "ok",
  "completed_at": "2026-04-21T22:30:01Z",
  "result": {
    "intent_interpretation": {
      "schema_version": "1.0.0",
      "interpretation_id": "interpret_01HZX8E7J2V3M4N5P6Q7R8S9T0",
      "interpretation_policy": "best_effort",
      "asset_id": "asset_01HZX8A7J2V3M4N5P6Q7R8S9T0",
      "version_id": "ver_01HZX8B7J2V3M4N5P6Q7R8S9T0",
      "analysis_report_id": "analysis_01HZX8C7J2V3M4N5P6Q7R8S9T0",
      "semantic_profile_id": "semantic_01HZX8D7J2V3M4N5P6Q7R8S9T0",
      "user_request": "Make it a little darker and cleaner.",
      "normalized_request": "Make it darker and less harsh.",
      "request_classification": "supported",
      "next_action": "plan",
      "normalized_objectives": ["darker", "less_harsh"],
      "candidate_descriptors": ["bright", "harsh"],
      "descriptor_hypotheses": [
        {
          "label": "bright",
          "status": "supported",
          "supported_by": ["semantic:bright"]
        },
        {
          "label": "harsh",
          "status": "weak",
          "supported_by": ["analysis:summary"],
          "needs_more_evidence": ["semantic:harsh"]
        }
      ],
      "rationale": "The request maps cleanly to a modest darker tonal shift plus harshness reduction.",
      "confidence": 0.78,
      "provider": {
        "kind": "openai",
        "model": "gpt-4.1-mini",
        "prompt_version": "intent_v1",
        "cached": false,
        "response_ms": 118
      },
      "generated_at": "2026-04-21T22:30:01Z"
    }
  }
}
